1,Police Negotiating Board,Home Office,Advisory NDPB,FULL,Abolish,No,Negotiates on matters relating to police pay and conditions; provides advice to the Home Secretary on matters related to policing.,To be abolished and replaced by the Police Remuneration Review Body,"Office of Manpower Economics, 6th Floor, Victoria House, Southampton Row, London, WC1B 4AD",020 7271 0472,william.blase@bis.gsi.gov.uk,http://www.ome.uk.com/,John Randall,£433 per day,William Blase,Civil Servant,No,No,No,-,2013-14,2012,"£456,834","£456,834",0,-,Yes,Ministerial,Paid,1,0,0,2 Ministerial,Paid,1,1,0,1
1,Security Industry Authority,Home Office,Executive NDPB,FULL,No longer an NDPB,Yes,"The Security Industry Authority (SIA) is the organisation responsible for regulating the private security industry. They are an independent body reporting to the Home Secretary, under the terms of the Private Security Industry Act 2001. ",The SIA was established under the Private Security Industry Act 2001.  The Chair's remuneration is  based on 1.5 working days per week.,"PO Box 49768, London, WC1V 6WY",020 7025 4250,cassie.howe@sia.gsi.gov.uk,http://sia.homeoffice.gov.uk/Pages/home.aspx,Elizabeth France,"£54,963",Bill Butler,"£125,000-£135,000",Yes,Yes,Yes,PHSO,2011-12,2010,"£1,700,000","£26,080,000",185,NAO,Yes,Ministerial,Paid,0,1,0,Ministerial,Paid,5,0,0,1
1,Serious Organised Crime Agency,Home Office,Executive NDPB,FULL,Merge,No,"SOCA is a UK-wide organisation whose main functions, set out in the Serious Organised Crime and Police Act 2005 (SOCPA), are to prevent and detect serious organised crime, to contribute to its reduction in other ways and the mitigation of its consequences and to gather, store, analyse and disseminate information on crime.","Sir Ian Andrews was the chair on the 31/3/2013. He resigned 1/8/2013 and Stephen Rimmer was appointed as his replacement.  SOCA ceased to operate on 7 October 2013 and was absorbed into the National Crime Agency, headed by Keith Bristow. ","1-7 Old Queen Street, London, SW1H 9HP",0870 496 5800,-,http://www.soca.gov.uk/,Stephen Rimmer,Civil Servant,Trevor Pearce,"£145,000-£150,000",No,No,Yes,-,2012-13,2013,"£211,250,000","£224,612,000",3750,NAO,No,0,0,0,0,0,0,0,0,0,0,1
1,Technical Advisory Board,Home Office,Advisory NDPB,FULL,Retain,No,To advise the Home Secretary on whether obligations imposed on communications service providers under the terms of the Regulation of Investigatory Powers Act 2000 (RIPA) are reasonable.,Established 2002.,"The Technical Advisory Board, PO Box 38542, London SW1H 9YE",-,TAB@homeoffice.x.gsi.gov.uk,https://www.gov.uk/tab,Peter Walker,£400 per day,M Dine,Civil Servant,No,No,No,None,2012-13,2013,-,-,0,NAO,Yes,Ministerial ,Paid ,1,0,0,Ministerial,Unpaid,10,2,0,1
1,Advisory Committee on Conscientious Objectors,Ministry of Defence,Advisory NDPB,FULL,Retain,No,The Committee is responsible for advising the Secretary of State for Defence on all claims to conscientious objection to further service in the Armed Forces made by officers and other ranks of the Armed Forces whose application for permission to retire or resign their commissions or for discharge have been refused by the Service authorities.,Established 1970.  When this body meets if the judge is salaried no fee is payable.,"06.F.12, MOD Main Building, Whitehall, London, SW1A 2HB",020 7218 0564,CLS-Sec1@mod.uk,https://www.gov.uk/government/organisations/advisory-committee-on-conscientious-objectors,HH Judge Joanna Korner CMG QC,£0,Tracy Sexton,Civil Servant,Yes,Yes,Yes,-,2009-10,2013,£0,£0,0,-,Yes,Non-Ministerial,Unpaid,0,1,0,3 Ministerial 1 non-Ministerial ,4 Unpaid,3,1,0,1
1,Armed Forces Pay Review Body,Ministry of Defence,Advisory NDPB,FULL,Retain,No,"The Armed Forces' Pay Review Body is to provide independent advice to the Prime Minister and the Secretary of State for Defence on the remuneration and charges for members of the naval, military and air forces of the Crown.",Established 1971.,"8th Floor, Fleetbank House, 2-6 Salisbury Square, London EC4Y 8JX.",0207 211 8210,anne.ball@bis.gsi.gov.uk,https://www.gov.uk/government/organisations/armed-forces-pay-review-body,Mr John Steele,£350 per day,Tony Symmonds,Civil Servant,No,No,Yes,-,2013-14,2014,"£55,650","£105,185",4,NAO,Yes,Ministerial,Paid,1,0,0,Ministerial,Paid,4,3,0,1
1,Central Advisory Committee on Pensions and Compensation,Ministry of Defence,Advisory NDPB,FULL,Retain,No,The CAC acts as a policy advisory and consultative body for all service pension and compensation issues.,"Established 1921. Following a Triennial Review, it was announced in October 2013 that CAC would no longer be an advisory NDPB, becoming instead a Stakeholder Advisory Group.","Central Advisory Committee on Pensions and Compensation, MOD Main Building, Level 6, Zone M, Desk 18, Whitehall, London SW1A 2HB ",020 7218 9681,PersTrg-Rem-AFCPol4@mod.uk,https://www.gov.uk/government/organisations/central-advisory-committee-on-pensions-and-compensation,"Minister of State for Defence Personnel, Welfare and Veterans",£0,Angela Owen,Civil Servant,No,Yes,Yes,PHSO,-,2013,-,-,-,-,-,0,0,0,0,0,0,0,0,0,0,1
1,Defence Nuclear Safety Committee,Ministry of Defence,Advisory NDPB,FULL,Retain,No,"The Defence Nuclear Safety Committee is responsible for providing the Secretary of State for Defence with an independent source of expertise and advice concerning the safety of Ministry of Defence nuclear programmes, facilities and operations.",Established 1999. Currently under Triennial Review . Goverment funding is aggregate of funding for Nuclear Research Advisory Council and Defence Nuclear Safety Committee.,"1.L.10, MOD Main Building, Whitehall, London SW1A 2HB",020 7218 7310,dst-strattechNWTSCF@mod.uk,https://www.gov.uk/government/organisations/defence-nuclear-safety-committee,Professor Laurence William,£465 per day,Civil Servant,Civil Servant,No ,No,No,PHSO,2013,2010,"£112,600","£89,206",1,NAO,Yes,Ministerial ,Paid,1,0,0,Ministerial,Paid,8,0,0,1
1,Defence Science and Technology Laboratory,Ministry of Defence,Executive Agency,FULL,-,No,To maximise the impact of science and technology for the defence and security of the UK.,"Established 2001.  As a Trading Fund, Defence Science and Technology Laboratory raises its revenue through the sale of goods and services to customers, including government customers.","Dstl Porton Down, Salisbury, Wilts, SP4 0JQ",01980 613000,centralenquiries@dstl.gov.uk,https://www.dstl.gov.uk/,Sir Richard Mottram,"£28,000",Jonathan Lyle, £150000-£155000,No,No,Yes,PHSO,2013-14,2010,"£644,400,000","£660,900,000","3,346",NAO,No,Ministerial,Paid,1,0,0,4 Ministerial 5 non-Ministerial,4 Paid 5 unpaid,5,4,0,1
1,Defence Scientific Advisory Council,Ministry of Defence,Advisory NDPB,FULL,Retain,No,"Defence Scientific Advisory Council is established to provide independent advice to the Secretary of State for Defence on all matters of concern to the Department in the fields of non-nuclear science, engineering, technology and analysis. ",Established 1969.,"1st Floor, Zone M, MOD Main Building, Whitehall, London SW1A 2HB",020 7218 7996,DST-StrategyAD@mod.uk,https://www.gov.uk/the-defence-scientific-advisory-council,Professor David Delpy,£465 per day,Civil Servant,Civil Servant,No,No,Yes,PHSO,2013-14,2014,"£226,000","£130,000",2,NAO,Yes,Ministerial,Paid,1,0,0,16 Ministerial,Paid,12,4,0,1
1,Defence Support Group,Ministry of Defence,Executive Agency,FULL,-,No,"To provide MOD with secure access to an assured capacity and capability for through-life maintenance, repair, overhaul (MRO), upgrade and procurement support for land and air equipment, both in the UK and in operational theatres.","Established 2008.  As a Trading Fund, it raises its revenue through the sale of goods and services to customers including government customers.  It does not receive a grant or grant-in-aid.","DSG Headquarters, Sedgemoor Building, Monxton Road, Andover, Hampshire, SP11 8HT",01264 383295,HOCF-BSG-TradingFundsAH@mod.uk,http://www.dsg.mod.uk/,Alex Jablonowski,"£25,000",Archie Hughes,"£160,000",No,No,Yes,PHSO,2013-14,2010,"£179,117,000","£179,478,000","2,700",NAO,No,Ministerial,Paid,1,0,0,2 Ministerial 6 non-Ministerial,2 Paid 6 unpaid,6,2,0,1
1,Independent Medical Expert Group,Ministry of Defence,Advisory NDPB,FULL,-,No,To provide advice and recommendations to Minister on the Armed Forces Compensation Scheme.,Established 2010 on an interim basis and as a permanent advisory NDPB in 2013.,"6.M.05 MOD Main Building, Whitehall, London SW1A 2HB",0207 218 2752,andrew.bates830@mod.uk,https://www.gov.uk/government/organisations/independent-medical-expert-group,Prof Sir Anthony Newman Taylor,£0,Andrew Bates,Civil Servant,No,No,No,-,2013,-,£0,£0,0,-,Yes,Ministerial,Unpaid,1,0,0,"5 Ministerial, 5 non-Ministerial",Unpaid,8,2,0,1
1,Independent Monitoring Board for the Military Corrective Training Centre,Ministry of Defence,Other NDPB,FULL,Retain,No,"The Independent Monitoring Board inspect the Military Corrective Training Centre at least twice a year and reports its findings to Ministers. It inspects, amongst other things, the condition of the premises and the treatment, health and welfare of detainees. The arrangements are very similar to those in place for civilian detention facilities in the UK.",Established 1979.,"MCTC, Berechurch Hall Road, Colchester, ESSEX, CO2 9NU. ",07850 642345,graham.cross@gmail.com,http://www.army.mod.uk/agc/provost/31946.aspx,Graham Cross,£0,David Smith,£0,No,No,No,-,2013,2010 (informal),£0,"£2,500",1,NAO,No,Ministerial,Unpaid,1,0,0,13 Ministerial,Unpaid,9,4,0,1
1,National Army Museum,Ministry of Defence,Executive NDPB,FULL,Retain,No,"To gather, maintain and make known the story of the British Army and its role and impact in world history. To provide a museum experience that meets the widest range of public need and connects the British public with its Army.",Established 1960.,"Royal Hospital Road, London,  SW3 4HT",020 7730 0717,INFO@NAM.AC.UK,http://www.nam.ac.uk,General Sir Jack Deverell KCB OBE,£0,Mrs Janice Murray,"£95,000",No,Yes,Yes,PHSO,2012-13,2009,"£6,392,874","£5,999,506",64,NAO,No,Non-Ministerial,Unpaid,1,0,0,10 Non-Ministerial,Unpaid,8,2,0,1
1,National Employer Advisory Board,Ministry of Defence,Advisory NDPB,FULL,Retain,No,"National Employer Advisory Board exists to provide informed but independent strategic advice to the Secretary of State for Defence and the MOD about how the MOD can most effectively gain and maintain the support of the employers of Britain's Reserve Forces.  The Board shall not exceed 15 members, and include representatives from the Confederation of British Industry, the Trades Union Congress, the Institute of Directors and the British Chambers of Commerce. The Board should provide wide geographical coverage of the UK and a broad representation between manufacturing and service industries, large and small companies and public sector.",Established 2002 (NEAB is the successor to the National Employers' Liaison Committee).,"The National Employers Advisory Board, Floor 6, Zone D, MOD Main Building, Whitehall, London, SW1A 2HB.",020 7807 0326,PersTrg-RFC-CapEmpSupSO1@mod.uk,https://www.gov.uk/government/organisations/national-employer-advisory-board,Mr R Boggis-Rolfe,£0,Wg Cdr Charlie Anderson ,Military Officer,No,No,No,PHSO,2009,2013,£0,£0,0,-,Yes,Ministerial,Unpaid,1,0,0,Ministerial,Unpaid,10,1,0,1
1,National Museum of the Royal Navy,Ministry of Defence,Executive NDPB,FULL,Retain,No,"The goal of the Museum is to promote public understanding of the Royal Navy and its constituent branches, past, present and future",Established 2008.,"HM Naval Base, (PP66) Portsmouth, PO1 3NH",02392 727562,graham.dobbin@nmrn.org.uk,http://www.nmrn.org.uk/,Admiral Sir Jonathon Band GCB,£0,Professor Dominic Tweddle,"£100,874 (Basic Salary as at January 2014)",No,Yes,Yes,PHSO,2011-12,2010/11,"£3,852,826","£13,437,244",124.75,NAO,No,Non-Ministerial ,Unpaid,1,0,0,15 Non-Ministerial,Unpaid,14,1,0,1
1,Nuclear Research Advisory Council,Ministry of Defence,Advisory NDPB,FULL,Retain,No,"The Nuclear Research Advisory Council (NRAC) is charged with reviewing the Atomic Weapons Establishment nuclear warhead capability sustainment programme, including the requirement for above ground experiments and other facilities and techniques necessary to develop and maintain a UK nuclear weapon capability in the absence of underground testing. The Council also examines the Atomic Weapons Establishments programme of international collaboration.","Established 2001. Triennial Review underway. Goverment funding for both NRAC and Defence Nuclear Safety Committee (DNSC) are aggregated, see funding for DNSC. ","1.L.14, MOD Main Building, Whitehall, London, SW1A 2HB",0207 218 7606,DST-StratTechNWTSCB@mod.uk,https://www.gov.uk/government/organisations/nuclear-research-advisory-council,Professor R Cashmore,£465 per day,Civil Servant,Civil Servant,No,No,No,PHSO,2013,2010,-,"£44,906",1,NAO,Yes,Ministerial,Paid,1,0,0,Ministerial,Paid,5,0,0,1
1,Review Board for Government Contracts,Ministry of Defence,Advisory NDPB,FULL,Retain,Yes,"Under an agreement between the UK Government and the Confederation of British Industry, first made in 1968, a Government Profit Formula and Associated Arrangements (GPF AA) exists to give contractors engaged on non-competitive government work a fair return.  The Board exists to make recommendations in respect of the GPF; to prescribe the Government Accounting Conventions for use in determining overhead costs; to resolve references to the Review Board by either MOD or Industry and to publish reviews on the GPF (known colloquially as the ""Yellow Book"").
","Established 1969. Following the passage of the defence reform Act 2014, it is intended that Review Board for Government will be replaced by a new executive NDPB, the Single Source Regulations Office.","Deloitte LLP, Athene Place, 66 Shoe Lane, London, EC4A 3BQ",020 7007 1512 ,geoffclark@deloitte.co.uk,https://www.gov.uk/government/organisations/review-board-for-government-contracts,John Price,"£11,750",Mr Geoff Clark,£0,No,No,No,-,2014,-,"£230,450","£229,463",1,-,Yes,Ministerial,Paid,1,0,0,Ministerial,Paid,3,1,0,1
1,Royal Air Force Museum,Ministry of Defence,Executive NDPB,FULL,Retain,No,"The Royal Air Force (RAF) Museum's objective is to promote public understanding of the history and traditions of the Royal Air Force by collecting, preserving and exhibiting artefacts and materials.",Established 1963.,"Grahame Park Way, Hendon, London, NW9 5LL",020 8205 2266,london@rafmuseum.org,http://www.rafmuseum.org.uk/,ACM Sir Glenn Torpy,£0,Mr John Kitchen,"£90,000-£95,000",No,Yes,Yes,PHSO,2013,2011/12,"£9,283,000","£12,651,847",182,NAO,Yes,Ministerial,Unpaid,1,0,0,Ministerial,Unpaid,12,1,0,1
1,Science Advisory Committee on the Medical Implications of Less-Lethal Weapons,Ministry of Defence,Advisory NDPB,FULL,Retain,No,"To provide advice on the biophysical, biomechanical, pathological and clinical aspects of generic classes of less-lethal weapon systems.",Established 2009.,"HQ Surgeon General, Floor 6 Zone E, MOD Main Building, Whitehall, London, SW1A 2HB",020 7807 0464,david.holdridge114@mod.uk,https://www.gov.uk/government/organisations/science-advisory-committee-on-the-medical-implications-of-less-lethal-weapons,Prof R J Flower FRS,£465 per day,Mr David Holdridge,Civil Servant,No,No,Yes,PHSO,-,2014,"£52,000","£48,225",0,-,Yes,Ministerial,Paid,1,0,0,Ministerial,Paid,7,1,0,1
1,UK Hydrographic Office,Ministry of Defence,Executive Agency,FULL,-,No,"To provide navigation charts and other hydrographic products and services to Defence, UK and other Governments, and for commercial shipping.","Established 1996.  As a Trading Fund, UK Hydrographic Office (UKHO) raises its revenue through the sale of goods and services to customers.","UKHO, Admiralty Way, Taunton, Somerset, TA1 2DN",01823 337900,customerservices@ukho.gov.uk,http://www.ukho.gov.uk/,Sandra Rogers,£0,Ian Moncrieff CBE,£115000-£120000,No,No,Yes,PHSO,2013-14,2009/10,"£11,856,000","£130,542,000","1,114",NAO,No,Ministerial,Paid,-,1,0,2 Ministerial/5 non-Ministerial,2 Paid 5 Unpaid,6,1,0,1
13,Veterans Advisory and Pensions Committees (x 13),Ministry of Defence,Advisory NDPB,FULL,Retain,No,Veterans Advisory and Pensions Committees (VAPC) play a central role in promoting the interests and welfare of veterans by: raising awareness of schemes administered by DBS Veterans UK; welfare pathways; advising and signposting veterans; and providing a consultative body able to engage with the MOD.,Established 1921.  Formerly known as War Pensions Committees.,"VAPC Focal Point, DBS Veterans UK, Room 6406, Norcross, Lancashire FY5 3WP",0808 1914 2 18,veterans-uk@mod.uk,http://www.veterans-uk.info/,Multiple (13),£0,Carole Corbett,Civil Servant,No,Yes,No,-,2011,2011,"£30,000","£29,443",0,OCPA/internal,Yes,Ministerial,Unpaid,11(1 Vacancy),1,0,Ministerial,Unpaid,137,38,0,13
47,Advisory Committee on Justices of the Peace (x47),Ministry of Justice,Advisory NDPB,FULL,Merge,No,"To recruit, select and recommend to the Lord Chief Justice candidates with the necessary qualities for appointment as Justices of the Peace in England and Wales.",Established circa 1970s.  101 Committees were reorganised to 47 following a review in 2010.  Funding has been the responsibility of HM Courts & Tribunal Service since 1 April 2006.  Costs incurred come from within HM Courts Service expenditure.  Though there are 47 chairs (one for each committee) some committees also have a deputy chair and some have sub-committee chairs - hence the total number of appointments is given as 52. ,"Judicial Office, 10th Floor, Thomas More Building, Royal Courts of Justice, Strand, London WC2A 2LL ",020 7073 4778,jahan.noorrahman@judiciary.gsi.gov.uk,-,Multiple,None,Justices' Clerks act as secretaries to the Advisory Committee,Civil Servants,No,No,Yes,-,2013-14,2012,£0,-,0,NAO,Yes,Ministerial,Unpaid,33,19,0,Ministerial,Unpaid,261,254,0,47
1,Advisory Council on National Records and Archives,Ministry of Justice,Advisory NDPB,FULL,Retain,No,To advise the Lord Chancellor on matters relating to records and archives in the UK and in particular in England and Wales especially access to historical records and the preservation of records and manuscripts.,Established 2003.  The Advisory Council on National Records and Archives' costs (including audit costs) are budgeted through The National Archives.   One secretariat is employed by The National Archives and is a shared resource with the Advisory Panel on Public Sector Information.,"The National Archives, Chief Executives Office, Kew, Richmond, Surrey, TW9 4DU ",020 8392 5337,advisorycouncilsecretary@nationalarchives.gsi.gov.uk,http://www.nationalarchives.gov.uk/advisorycouncil/default.htm,Master of the Rolls - Lord Dyson,£0,Civil Service Secretariat ,Civil Servant,No,Yes,Yes,PHSO,2013-14,2013,"£4,368","£4,368",-,-,Yes,0,Unpaid,1,0,0,Ministerial,Unpaid,13,4,0,1
1,Advisory Panel on Public Sector Information,Ministry of Justice,Advisory NDPB,FULL,Retain,No,To advise Ministers on how to encourage and create opportunities in the information industry for greater re-use of public sector information; to advise on changes and opportunities in the information industry; to review and consider complaints under the Re-use of Public Sector Information Regulations 2005 and advise on the impact of the complaints procedures under those regulations. ,Established 2003.  The Advisory Panel on Public Sector Information's costs (including audit costs) are budgeted through The National Archives.  Triennial Review due 2013/2014.  One secretariat is employed by The National Archives and is a shared resource with the Advisory Council on National Records and Archives. ,"The National Archives, Chief Executives Office, Kew, Richmond, Surrey, TW9 4DU ",020 8392 5337,secretariat@appsi.gsi.gov.uk ,http://www.nationalarchives.gov.uk/appsi/default.htm,Professor David Rhind CBE,"£4,000",Civil Servant Secretariat,Civil Servant,No,Yes ,Yes,PHSO,2010,2010,"£6,244","£6,244",-,-,Yes,Ministerial,Paid,1,0,0,Ministerial,Unpaid,13,2,0,1
1,Civil Justice Council,Ministry of Justice,Advisory NDPB,FULL,Retain,No,"The Civil Justice Council has a statutory duty under the Civil Procedure Act 1997 to keep the civil justice system under review; consider how to make the civil justice system more accessible, fair and efficient; advise the Lord Chancellor and the Judiciary on the development of the civil justice system; refer proposals for change in the civil justice system to the Lord Chancellor and the Civil Procedure Committee; and make proposals for research. ","Established under the Civil Procedure Act 1997. Of the non-Ministerial appointments, the Chair, the Deputy Chair and three of the members are judicial appointments (these three appointments were vacant until October 2012). Currently undergoing a Triennial Review.","Royal Courts of Justice, London, WC2A 2LL",020 7947 6670,cjc@judiciary.gsi.gov.uk,http://www.judiciary.gov.uk/about-the-judiciary/advisory-bodies/cjc,The Right Hon Lord Dyson,£0,Peter Farr,Civil Servant,Yes,Yes,Yes,-,2011-12,-,"£39,667","£42,321",2,-,Yes,Ex-officio,Unpaid,1,0,0,"15 Ministerial, 4 non-Ministerial",Unpaid,14,4,1,1
1,Civil Procedure Rule Committee,Ministry of Justice,Advisory NDPB,FULL,Retain,No,"The Civil Procedure Rule Committee was created by virtue of Section 2 of the Civil Procedure Act 1997 (as amended by section 83 of the Courts Act 2003) to make rules of court for the Civil Division of the Court of Appeal, the High Court and the county courts.",Established 1998.  Minutes of meetings available on request.  One secretariat staff member.,"4th Floor, 102 Petty France, London, SW1H 9AJ",020 3334 3184,Jane.wright@justice.gsi.gov.uk,https://www.gov.uk/government/organisations/civil-procedure-rules-committee,Master of the Rolls - Lord Dyson,£0,Jane Wright,Civil Servant,Yes,No,Yes,-,2011,-,£0,£0,0,-,Yes,Ex-officio,Unpaid,1,0,0,8 Ministerial/8 non-Ministerial,Unpaid,13,3,0,1
1,Criminal Cases Review Commission,Ministry of Justice,Executive NDPB,FULL,Retain,No,"To review possible miscarriages of justice in the criminal courts of England, Wales and to refer appropriate cases to the appeal courts.",Established 1997.,"5 St Philip's Place, Birmingham, B3 2PW",0121 233 1473,info@ccrc.gov.uk,http://www.justice.gov.uk/about/criminal-cases-review-commission,Richard Foster CBE,"£83,840",Karen Kneller ,"£87,500",No,No,Yes,-,2013-14,2013,"£5,470,000","£6,237,000",96,NAO,Yes,Non-ministerial,Paid,1,0,0,11 Non-Ministerial,Paid,5,6,0,1
1,Criminal Injuries Compensation Authority,Ministry of Justice,Executive NDPB,FULL,Retain,No,A government organisation that can pay money (compensation) to people who have been physically or mentally injured because they were the blameless victim of a violent crime.,"Established 1996.  Formally transitioned to Executive Agency status 1 April 2014. CE Remuneration is salary received for 2013-14, plus any bonus paid.  There are no public appointments. ","Tay House, 300 Bath Street, Glasgow, G2 4LN",0300 003 3601,-,https://www.gov.uk/government/organisations/criminal-injuries-compensation-authority,-,-,Carole Oatway,"£95,000-£100,000",No,Yes,Yes,PHSO,2012-13,2013,"£247,091,000","£273,000,000",327,NAO,Yes,0,0,0,0,0,0,0,0,0,0,1
1,Criminal Procedure Rule Committee,Ministry of Justice,Advisory NDPB,FULL,Retain,No,To streamline and modernise the practice and procedure to be followed in the criminal trials of England and Wales (section 69 of the Courts Act 2003 refers.) The membership reflects the key participants in the conduct of a criminal case.  The Criminal Procedure Rule Committee consults widely before making new rules.,Established 2004.  The first Criminal Procedure Rules were made in 2005 and the first consolidated Criminal Procedure Rules were made in 2010.  Minutes of meetings available on request.,"Secretariat to the Criminal Procedure Rule Committee, 7th Floor 102 Petty France, London, SW1H 9AJ",0203 334 4031,"CriminalProcedureRuleEnquiries@justice.gsi.gov.uk
","https://www.gov.uk/government/organisations/criminal-procedure-rule-committee
","The Rt. Hon. Lord Judge, the Lord Chief Justice of England and Wales ",£0,Jonathan Solly,Civil Servant,Yes,No,Yes,-,-,-,£0,£0,0,-,Yes,Ex-officio,Unpaid,1,0,0,"1 Ex-officio, 5 non-Ministerial, 12 Ministerial",Unpaid,14,4,0,1
1,Family Justice Council,Ministry of Justice,Advisory NDPB,FULL,Retain,No,"The Family Justice Council (FJC) aims to facilitate the delivery of better and quicker outcomes for families and children who use the family justice system. The Council's primary role is to promote an inter-disciplinary approach to family justice, and through consultation and research, to monitor how effectively the system both as a whole and through its component parts delivers the service the Government and the public need and to advise on reforms necessary for continuous improvement. It is chaired by the President of the Family Division and under its revised terms of reference provides expert advice directly to the Family Justice Board and Government on the operation and reform of the Family Justice System.","Established 2004.  The FJC Secretariat became part of the President of the Family Division's Private Office in August 2012.  The Triennial Review, which started in October 2013, is at the end of Stage 1, currently awaiting confirmation to commence Stage 2.","Office of the President of the Family Division, WG 62, Royal Courts of Justice, Strand, London, WC2A 2LL",020 7947 7333,fjc@justice.gsi.gov.uk,http://www.judiciary.gov.uk/about-the-judiciary/advisory-bodies/fjc,The President of the Family Division -Sir James Munby,£0,"Alex Clark, Secretary to FJC and Private Secretary to the President",Civil Servant,Yes,Yes,Yes,-,2013-14,-,"£18,000","£18,000",3,-,Yes,Ex-officio,Unpaid,1,0,0,Ministerial and non-Ministerial ,Unpaid,9,10,0,1
