Count,Name,Department,Classification,PB13 Entry,PB Reform,Regulatory Function,Description / Terms of Reference,Notes,Address,Phone,email,Website,Chair,Chair's Remuneration (p.a. unless otherwise stated),Chief Executive / Secretary,Chief Executive / Secretary Remuneration,Public Meetings,Public Minutes,Register of Interests,Ombudsman,Last Annual Report,Last Review,Government Funding,Total Gross Expenditure,Staff employed,Audit Arrangements,OCPA Regulated,Chair Ministerial or non-ministerial Appt,Chair Paid or unpaid,Chair Male?,Chair Female?,Chair Gender Unknown/ undeclared?,Board Members Ministerial or non-ministerial Appt,Board Members Paid or unpaid,Male Board Members,Female Board Members,Gender Unknown/ undeclared Board Members,No. Bodies
1,Advisory Committee on Business Appointments,Cabinet Office,Advisory NDPB,FULL,Retain,No,The Committee provides independent advice when a senior Crown servant or former Minister leaves office and wishes to take up an outside appointment or employment.,Established 1975.  Staffed by a joint secretariat which also supports the Civil Service Commission and the House of Lords Appointments Commission . Secretary is Ekpe Attah. ,"G/08, Ground Floor, 1 Horse Guards Road, London SW1A 2HQ",020 7271 0839,acoba@acoba.gsi.gov.uk  ,http://acoba.independent.gov.uk,Sir Hugh Stevenson (interim Chair),"£8,000",Chief Executive of the Civil Service Commission (which provides secretariat services to ACOBA) = Clare Salters,"£65,000-£70,000",No,Yes,Yes,-,2012-13,-,"£269,000","£196,000",2.3,NAO as part of audit of Civil Service Commission's accounts,Yes,Ministerial ,Paid,1,0,0,Ministerial,Paid,4,2,0,1
1,Big Lottery Fund,Cabinet Office,Executive NDPB,FULL,Retain,No,"The Big Lottery Fund (BLF) distributes its 40% share of National Lottery good causes money to bring real improvements to communities and the lives of people most in need. While sponsored by Cabinet Office, BLF is also financially accountable to Department for Culture, Media and Sport for management of its lottery money. ","Predecessor body established 1994; BLF established by the National Lottery Act 2006.  CEO Peter Wanless left 31/5/13; acting CEO 1/6/13 to 30/9/13 Ceri Doyle; new CEO - Dawn Austwick - took up post 1/10/13.  CEO's remuneration is for Dawn Austwick, for a full year.  Nil government funding - funded from National Lottery proceeds. Triennial Review report published June 2014. ","1 Plough Place, London, EC4A 1DE",020 7211 1800,general.enquiries@biglotteryfund.org.uk ,http://www.biglotteryfund.org.uk/,Peter Ainsworth,"£28,800",Dawn Austwick,"£140,000 -  £145,000 ",No,Yes,Yes,PHSO,2013-14,2013-14,£0,"£970,506,000",992,NAO,Yes,Ministerial,Paid,1,0,0,Ministerial,Paid ,7,3,0,1
1,Boundary Commission for England,Cabinet Office,Advisory NDPB,FULL,-,No,The Commissions statutory function is to keep under review the distribution of constituencies in England and to make reports with recommendations every 5 years in accordance with the provisions of the Parliamentary Constituencies Act 1986 (as amended).,"Established 1944.  The Chair of the Commission is the Speaker of the House of Commons ex officio, but in practice he does not participate in the formulation of the Commissions recommendations, nor in the conduct of reviews.","1 Horse Guards Road, London SW1A 2HQ",020 7276 1102,information@bcommengland.gsi.gov.uk,http://consultation.boundarycommissionforengland.independent.gov.uk/,Speaker of the House of Commons (ex officio),£0,Tony Bellringer,Civil Servant,No,Yes,Yes,PHSO,2012-13,-,"£370,000","£284,189",2,NAO (as part of sponsor department accounts),Yes,Non-Ministerial,Unpaid,1,0,0,Ministerial,"2 Paid, 1 unpaid",3,0,0,1
1,Boundary Commission for Wales,Cabinet Office,Advisory NDPB,FULL,-,No,The Commissions statutory function is to keep under review the distribution of constituencies in Wales and to make reports with recommendations every 5 years in accordance with the provisions of the Parliamentary Constituencies Act 1986 (as amended).,"Established 1944.  The Chair of the Commission is the Speaker of the House of Commons ex officio, but in practice he does not participate in the formulation of the Commissions recommendations, nor in the conduct of reviews.","Ground Floor, Hastings House, Fitzalan Court, Cardiff, CF24 OBL",02920 464819,bcomm.wales@wales.gsi.gov.uk,http://bcomm-wales.gov.uk,Speaker of the House of Commons (ex officio),£0,Steve Halsall,Civil Servant,No,Yes,Yes,PHSO,2012-13,-,"£94,269","£94,269",4,WAO,Yes,Non Ministerial,Unpaid,1,0,0,Ministerial,"1 Unpaid, 2 paid",3,0,0,1
1,Civil Service Commission,Cabinet Office,Executive NDPB,FULL,-,Yes,Regulates recruitment to the Civil Service,"Established 1855, NDPB since 2011. Triennial review was announced in July 2014 and is due to complete in Autumn 2014. ","1 Horse Guards Road, London, SW1A 2HQ",020 7271 0831,info@csc.gsi.gov.uk,http://civilservicecommission.independent.gov.uk/,Sir David Normington GCB,"£85,000-£90,000",Clare Salters,"£65,000-£70,000",No,Yes,Yes,No,2013-14,-,"£1,431,000","£1,328,000",19.3,NAO,No,Ministerial,Paid,1,0,0,0,Paid,3,6,0,1
1,Committee on Standards in Public Life,Cabinet Office,Advisory NDPB,FULL,Retain,No,"The Committee examines standards of ethical conduct among public office holders in the UK and makes recommendations to the government as to any changes in present arrangements, including those relating to party funding.","Established 1994. Sir Christopher Kelly was Chair on 31 March 2013.  Lord Bew was appointed in September 2013.  Sir Christopher Kelly was paid a flat rate of £50,000 a year, which had remained unchanged since his appointment.  The new Chair is being paid on the basis of a non-pensionable salary of £500 per day, with the expectation that he should to commit an average of 2-3 days a month, although this can increase significantly during Committee inquiries. Between April and September 2013, the interim Chair, David Prince CBE, was paid on the same basis as Lord Bew.","1 Horse Guards Road, London, SW1A 2HQ",020 7271 0853,public@standards.gsi.gov.uk,http://www.public-standards.gov.uk/,Lord Bew,£500 per day,Ruth Thompson,Civil Servant,No,Yes,Yes,PHSO,2013-14,2013,"£400,000","£330,875",3,Overseen by the Cabinet Office Accounting Officer,Yes,Ministerial,Paid,1,0,0,Ministerial ,Paid,3,4,0,1
1,Government Procurement Service,Cabinet Office,Executive Agency,FULL,-,No,The Government Procurement Service (GPS) provides centralised commercial and procurement services for Government and the UK public sector,Established as the Buying Agency in 1991.  The Government Procurement Service is an Executive Agency and a Trading Fund.  GPS and other teams  came together to form the Crown Commercial Service on 1 April 2014. David Shields was MD until June 2013. Bill Crothers was chair until 31 August 2014 (unpaid for FY 13/14).,"9th Floor Capital Building, Old Hall Street, Liverpool L3 9PP",0345 410 2222,info@ccs.gsi.gov.uk,http://ccs.cabinetoffice.gov.uk/,Ed Smith,£0,Sally Collier,"£115,000-£120,000",No,No,Yes,PHSO,2013-14,-,-,"£45,127,000",483,NAO,No,Ministerial,Unpaid,1,0,0,Non-Ministerial,"4 Paid, 2 unpaid",7,0,0,1
1,House of Lords Appointments Commission,Cabinet Office,Advisory NDPB,FULL,Retain,No,The Commission's role is to select new independent members of the House of Lords and to vet party-political nominations put forward by the political parties.,Established 2000.  Staff are joint secretariat with Advisory Committee on Business Appointments. Supported by staff of the Civil Service Commission. Broadly equivalent to 2.3 FTE. ,"G5, Ground Floor, 1 Horse Guards Road, London SW1A 2HQ",020 7271 0848,enquiry@lordsappointments.gsi.gov.uk,http://lordsappointments.independent.gov.uk/,Lord Kakkar,"£8,000",Chief Executive of the Civil Service Commission (which provides secretariat services to HOLAC) and secretary = Clare Salters,"£65,000-£70,000",No,Yes,Yes,-,2011-12,2013,"£185,000","£205,000",2.3,NAO as part of audit of Civil Service Commission's accounts,Yes,Ministerial,Paid,1,0,0,Ministerial ,Paid,4,2,0,1
1,Security Vetting Appeals Panel,Cabinet Office,Advisory NDPB,FULL,Retain,No,To hear appeals against the refusal or withdrawal of security clearance and to make recommendations to the appropriate head of department.,Established 1997.,"The Secretary, Security Vetting Appeals Panel, Room 335, Cabinet Office, 70 Whitehall, London SW1A 2AS.",020 7276 5645,svap@cabinet-office.x.gsi.gov.uk,-,Sir George Newman,"£13,480 (£793 per day when sitting)",Martin Sterling,Civil Servant,No,No,Yes,-,2013,2013,"£56,000","£80,000",2,-,Yes,Ministerial,Paid,1,0,0,Ministerial,"8 Paid, 2 unpaid",8,2,0,1
1,Senior Salaries Review Body,Cabinet Office,Advisory NDPB,FULL,Retain,No,"The Review Body on Senior Salaries provides independent advice to the Prime Minister, the Lord Chancellor and the Secretary of State for Defence on the remuneration of holders of judicial office, senior civil servants, senior officers of the armed forces and other such public appointments as may from time to time be specified. ",Established 1971.  Members are paid per day.,"Office of Manpower Economics, 8th Floor, Fleetbank House, 2-6 Salisbury Square, London, EC4Y 8JX
",020 7211 8300,neil.higginbottom@bis.gsi.gov.uk ,http://www.ome.uk.com/Senior_Salaries_Review_Body.aspx,"Bill Cockburn, CBE TD","£11,500",-,-,No,No,Yes,-,-,2014,"£32,000","£32,000",-,NAO,Yes,1 Ministerial ,Paid,1,0,0,7 Ministerial ,Paid,5,2,-,1
1,Charity Commission for England and Wales,Charity Commission for England and Wales,Non Ministerial Department,FULL,Retain,Yes,"The Charity Commission is the independent Government department which registers and regulates charities in England and Wales, as set out in the Charities Act 2011.",Established 1853.  CE remuneration is 12/13 salary.  NAO value for money review 2013.,"PO Box 1227, Liverpool L69 3UG",0845 3000 218,fcemailteam@charitycommission.gov.uk,http://www.charitycommission.gov.uk/,William Shawcross CVO,"£50,000",Sam Younger CBE,"£130,000-£135,000",Yes,No,Yes,PHSO,2012-13,2013,"£23,414,000","£23,210,000",311,NAO,Yes,Ministerial,Paid,1,0,0,Ministerial,Paid,4,3,0,1
1,Commissioners for the Reduction of the National Debt,Commissioners for the Reduction of the National Debt,Non Ministerial Department,FULL,-,No,"The Commissioners for the Reduction of the National Debt (CRND)'s main function is the investment and management of government funds, including the National Insurance Fund Investment Account, the National Lottery Distribution Fund Investment Account and the Court Funds Investment Account.","The origins of the CRND can be traced back to the National Debt Reduction Act of 1786. There are nine ex officio Commissioners (The Chancellor of the Exchequer, The Governor and Deputy Governors of the Bank of England, The Speaker of the House of Commons, The Master of the Rolls, The Accountant General of the Senior Courts and the Lord Chief Justice). The CRNDs functions are entirely carried out by, and incorporated into, the United Kingdom Debt Management Office (DMO) through the nomination of DMO staff to the two statutory executive roles of the public body, the Comptroller General and the Assistant Comptroller. The operations of the CRND are allocated across the DMOs organisational structure and are carried out by its civil servants. No separate annual report is published for the CRND. Annual accounts are produced for the funds managed although these are not published by the DMO. CRND are not audited, the report and accounts for the individual funds managed by CRND are audited by the NAO.","UK Debt Management Office, Eastcheap Court, 11 Philpot Lane, London, EC3M 8UD",020 7862 6610,crnd@dmo.gsi.gov.uk,http://www.dmo.gov.uk/index.aspx?page=CRND/CRND_Index,-,-,Jo Whelan (Comptroller General),Civil Servant,No,No,Yes,-,-,-,£0,£0,0,-,No,0,0,0,0,0,0,0,0,0,0,1
1,Crown Prosecution Service,Crown Prosecution Service,Non Ministerial Department,FULL,-,No,"The Crown Prosecution Service (CPS) is an independent body set up in 1986 to prosecute criminal cases in England and Wales. The CPS works closely with the police and other investigators to advise on lines of inquiry and to decide on appropriate charges or other disposals in all but minor cases. CPS prosecutors prepare cases for court and present cases in both the magistrates courts and, increasingly, in the higher courts. The Director of Public Prosecutions is the head of the CPS and operates independently, under the superintendence of the Attorney General who is accountable to Parliament for the work of the CPS.",Created by the Prosecution of Offences Act 1985. ,"Rose Court, 2 Southwark Bridge, London SE1 9HS",020 3357 0000,enquiries@cps.gsi.gov.uk,http://www.cps.gov.uk/,Alison Saunders,"£158,614",Peter Lewis,"£176,826",No,Yes,Yes,-,2013-14,-,"£563,000,000","£552,000,000","6,166",NAO,Yes,non-ministerial,Paid,0,1,0,Non-Ministerial ,Paid,6,1,0,1
1,"Advisory, Conciliation and Arbitration Service (Acas)","Department for Business, Innovation and Skills",Executive NDPB,FULL,Retain,No,The aim of Acas is to improve organisations and working life through better employment relations.,Established 1975.  Anne Sharp became CE in February 2013; remuneration shown is full year salary.  Triennial Review commenced 2013.,"Acas National (Head Office), Euston Tower, 286 Euston Road, London NW1 3JJ.",020 7210 3623,secretariat@acas.org.uk,http://www.acas.org.uk/,Sir Brendan Barber,"£75,000-£80,000",Anne Sharp,"£110,000-£115,000",No ,No ,Yes ,PHSO,2013-14,2014,"£45,800,000","£49,888,000",£787.00,NAO,Yes,Ministerial,Paid,1,0,0,Ministerial,Paid,5,5,0,1
1,Arts and Humanities Research Council,"Department for Business, Innovation and Skills",Executive NDPB,FULL,Retain,No,"To promote and support research and postgraduate training in the arts and humanities.  To encourage the wider application of, and raise the profile of, arts and humanities research.",Established 2005.  Minutes are available on request.  Triennial Review began 2013.,"Polaris House, North Star Avenue, Swindon, Wilts SN2 1FL",01793 416000,enquiries@ahrc.ac.uk,http://www.ahrc.ac.uk/,Sir Drummond Bone,"£16,430",Professor Rick Rylance,"£125,000-£130,000",No,No,Yes,PHSO,2012-13,2014,"£106,545,400","£106,545,400",84,NAO,Yes,Ministerial,Paid ,1,0,0,Ministerial,Paid,8,3,0,1
1,Biotechnology and Biological Sciences Research Council ,"Department for Business, Innovation and Skills",Executive NDPB,FULL,Retain,No,"The Biotechnology and Biological Sciences Research Council is the UK funding agency for research in the life sciences.  BBSRC carries out its mission by funding research, providing training in the biosciences and fostering opportunities for knowledge. ",Established 1994.  Triennial Review began 2013.,"Polaris House, North Star Avenue, Swindon, Wilts, SN2 1UH",01793 413200,bbsrc.inquiries@bbsrc.ac.uk,http://www.bbsrc.ac.uk/,Professor Sir Tom Blundell,"£16,430",Professor Jackie Hunter,"£140,000-£145,000",No,Yes,Yes,PHSO,2012-13,2014,"£443,058,000","£518,380,000",1493,NAO,Yes,Ministerial,Paid,1,0,0,-,Paid,10,5,-,1
1,British Hallmarking Council,"Department for Business, Innovation and Skills",Executive NDPB,FULL,Retain,Yes,The British Hallmarking Council supervises UK hallmarking.,"Established 1973.  Financial and remuneration information is for the year ending 31 December 2013. Ms Geraldine Swanton (Secretary) fees charged at agreed hourly rate by SGH Martineau LLP, Ms Swanton's employer, for secretarial services to the BHC. Currently under Triennial Review.","Geraldine Swanton, Secretary, British Hallmarking Council, No 1 Colmore Square, Birmingham B4 6AA",0870 763 1455,geraldine.swanton@martineau-uk.com,https://www.gov.uk/government/organisations/british-hallmarking-council,Christopher Jewitt,"£14,000","Ms Geraldine Swanton (Secretary)
","£26,230",No,No,Yes,PHSO,2013,"2010 
",£0,"£66,475",0,NAO,Yes,Non-Ministerial,Paid,1,0,0,"10 Ministerial, 8 non-Ministerial",All unpaid,16,2, - ,1
1,Capital for Enterprise Limited,"Department for Business, Innovation and Skills",Executive NDPB,FULL,no longer an NDPB,No,Capital for Enterprise Ltd (CfEL) is the principal centre of expertise within Government on the provision of Small and Medium Enterprise financial interventions.," CfEL ceased to operate in its current form on 1 October 2013 when staff transferred to BIS. When the British Business Bank is created (autumn 2014), it is likely that CfEL will cease to exist. Currently it only exists to oversee Capital for Fund Managers Ltd - which undertakes a regulated activity which cannot be done within BIS. The vast majority of CfEL functions are now carried out by BIS (and the Department now employs the associated staff).","Capital for Enterprise Ltd, Foundry House, 3 Millsands, Sheffield, S3 8NH",0114 206 2131,info@capitalforenterprise.gov.uk,http://www.capitalforenterprise.gov.uk/,Patrick Magee,£0,Keith Morgan,£0,No,No,Yes,PHSO,2012-13,-,"£2,883,169","£2,977,383",37,NAO,Yes,0,0,1,0,0,0,0,0,0,0,1
1,Central Arbitration Committee,"Department for Business, Innovation and Skills",Tribunal NDPB,FULL,Retain,No,Adjudicating on issues around statutory trade union recognition and complaints brought under UK employees' information and consultation laws.,"Established 1976.  The Chair is a High Court Judge salaried by the Ministry of Justice; a proportion of his salary is refunded to the Ministry of Justice by the Dept of Business, Innovation and Skills.  The CAC was to be merged under the reform programme but will now be retained. Funded through Acas.","Euston Tower, 286 Euston Road, London NW1 3JJ.",020 7904 2300,enquiries@cac.gov.uk,http://www.cac.gov.uk/,Sir Michael Burton,£0,Simon Gouldstone,"£63,663",No,No,Yes,PHSO,2013-14,-,-,-,-,NAO,No,Ministerial,Paid,1,0,0,Ministerial,Paid,34,13,0,1
1,Companies House,"Department for Business, Innovation and Skills",Executive Agency,FULL,Retain,Yes,"Incorporates and dissolves limited companies, registers the information companies are legally required to supply, and makes that information available to the public.",Established 1844.  ,"Crown Way, Cardiff, CF14 3UZ",0303 1234 500,enquiries@companies-house.gov.uk,http://www.companieshouse.gov.uk/,Brian Landers,"£25,000-£30,000",Tim Moss,-,No,No,Yes,PHSO,2013-14,2013,"£5,000,000","£61,100,000",827,NAO,Yes,-,Paid,1,0,0,Ministerial,Paid (excluding ShEx NED),4,2,-,1
1,Competition Appeal Tribunal,"Department for Business, Innovation and Skills",Tribunal NDPB,FULL,Retain,No,Hearing of appeals in respect of various competition related matters.,Established 1 April 2003. Administration for the Competition Appeal Tribunal is provided by the Competition Service as an Executive NDPB.  Currently under Triennial Review.,"Victoria House, Bloomsbury Place, London, WC1A 2EB",020 7979 7979,-,http://www.catribunal.org.uk/,Sir Peter Roth,"£174,481",Charles Dhanowa,"£97,555",Yes,No,Yes,-,2012-13,-,£0,£0,0,NAO,N/A,Ministerial,Paid,1,0,0,Ministerial,Paid,16,4,0,1
1,Competition Commission,"Department for Business, Innovation and Skills",Executive NDPB,FULL,Merge ,Yes,"To investigate and report on matters referred to it relating to mergers, markets and anti-competitive practices, and the regulation of utilities.",Established 1 April 1999.Chair appointment information includes 3 deputies.  Members include 3 non-executive directors who serve on the Commissions governing council.  They do not sit on inquiry panels. The CCs minutes used to be published on the web up until 2011. Due to a re-design of the CCs website this wasnt continued though they have been in contact with their IT and press teams and have agreed to retrospectively publish these papers.,"Victoria House, Southampton Row, London, WC1B 4AD",020 7271 0100,info@cc.gsi.gov.uk,http://www.competition-commission.org.uk/,Roger Witcomb,"£179,204",David Saunders,"£183,188",No,No ,Yes,-,2012-13,2007,"£23,238,000","£23,238,000",141,NAO,Yes,0,0,0,0,0,0,0,0,0,0,1
1,Competition Service,"Department for Business, Innovation and Skills",Executive NDPB,FULL,No longer an NDPB,No,To fund and provide support services to the Competition Appeal Tribunal.,Established 1 April 2003. Currently under Triennial Review ,"Victoria House, Bloomsbury Place, London, WC1A 2EB",020 7979 7979,-,http://www.catribunal.org.uk/,Susan Scholefield,£350 per day,Charles Dhanowa,"£97,555",No,No,No,-,2012-13,-,"£3,920,000","£3,892,000",16,NAO,Yes,0,0,0,0,0,0,0,0,0,0,1
1,Construction Industry Training Board,"Department for Business, Innovation and Skills",Executive NDPB,FULL,Retain,Yes,To ensure the quantity and quality of training provision is adequate to meet the current and future skills needs of the industry.,"Established 1964.  The Chair has waived his entitlement to a salary.  Chief Executive at 31.3.13 was Mark Farrar - Current Chief Executive is interim and remuneration is a 'day-rate' employment contract for an individual who operates as a professional interim as opposed to a 'remuneration package' for a permanent Chief Executive.  Triennial Review began 2013 and ongoing. Chair William Burton (interim CEO from 28 May 2013 - 31 March 2014).  Adrian Belton appointed new permanent CEO on 1.04.14, salary of £142,500. Deputy Chair is paid.","Bircham Newton, King's Lynn, Norfolk PE31 6RH",0300 456 7577 or 0344 994  4400,call.centre@citb.co.uk,http://www.citb.co.uk/,James Wates,£0,William Burton ,"£1,100 per day",No,Yes,Yes,PHSO,2013,2003,£0,"£267,761,000",1375,NAO,Yes,Ministerial,Paid,1,0,0,Ministerial,Unpaid ,17,1,0,1
1,Consumer Futures,"Department for Business, Innovation and Skills",Executive NDPB,FULL,No longer an NDPB,No,"Statutory consumer body providing advocacy for energy and postal consumers in England, Wales and Scotland;  postal consumers in Northern Ireland; and water consumers in Scotland.","Established under Consumer, Estate Agents and Redress Act 2007.  Name changed to Consumer Futures from Consumer Focus, April 2013 following transfer of general consumer advocacy functions to the Citizens Advice Service, leaving Consumer Futures as the advocating body for consumers in the Energy and Postal regulated sectors only, funding for which is  recovered from the regulators via a levy on the industries. Chair Mike O'Connor stood down end 2012/2013, salary £118500. Chairs remuneration is on a 3 days per week basis.  Of the Government Funding £8,459,000 is recovered from industry.","Victoria House, Bloomsbury Place, London, WC1A 2EB",020 7799 7900,contact@consumerfutures.org.uk,http://www.consumerfutures.org.uk/,Christine Farnish,"£48,000",Stephen Dunmore interim CEO and AO until 31 March 2014 when CF was abolished.,£80-£85K pro rata ,No,No,Yes,PHSO,2012-13,2009,"£9,432,000","£9,340,000",147,NAO,Yes,0,0,0,0,0,0,0,0,0,0,1
1,Copyright Tribunal,"Department for Business, Innovation and Skills",Tribunal NDPB,FULL,Retain,Yes,Deals with collective licensing disputes between business and collecting societies. ,Established 1956.,"4 Abbey Orchard Street, London, SW1P 2HT",020 7034 2836,catherine.worley@ipo.gov.uk,http://www.ipo.gov.uk/ctribunal.htm,Judge Hacon,£0,-,-,Yes,No,Yes,-,-,2008,£0,£0,-,-,No,Ministerial,Unpaid,1,0,0,Ministerial,8 Paid,5,3,0,1
1,Council for Science and Technology,"Department for Business, Innovation and Skills",Advisory NDPB,FULL,Retain,No,The CST advises the Prime Minister on strategic science and technology issues that cut across the responsibilities of individual government departments.,Established 1993 and relaunched in 2004.  Co-chaired by Sir Mark Walport and Professor Dame Nancy Rothwell. Reporting is subsection of GO-Science Annual Report. Triennial Review began 2013.,"CST Secretariat - 5th Floor, Spur 2, 1 Victoria Street, London, SW1H 0ET",020 7215 1092,cstinfo@bis.gsi.gov.uk,http://www.bis.gov.uk/cst,Multiple ,£0,Alan Pitt,Civil Servant,No,Yes,Yes,PHSO,2012-13,2013,£0,"£159,838",2,NAO,Yes,Ministerial,Unpaid,1,1,0,Ministerial,Unpaid ,13,5,0,1
1,Economic and Social Research Council,"Department for Business, Innovation and Skills",Executive NDPB,FULL,Retain,No,"The Economic and Social Research Council funds research into the big social and economic questions facing society today.  ESRC also develops and trains the UK's future social scientists.  ESRC's research informs public policies and helps make businesses, voluntary bodies and other organisations more effective.",Established 1965. Triennial Review began 2013.,"Polaris House, North Star Avenue, Swindon, SN2 1UJ",01793 413000,comms@esrc.ac.uk,http://www.esrc.ac.uk/,Dr Alan Gillespie,"£16,430",Professor Paul Boyle,"£120,000-£125,000",No,Yes,Yes,PHSO,2012-13,2014,"£211,000,000","£222,867,000",142,NAO,Yes,Ministerial,Paid,1,0,0,Ministerial,11,0,0,11,1
1,Engineering and Physical Sciences Research Council,"Department for Business, Innovation and Skills",Executive NDPB,FULL,Retain,No,"The main UK government agency for funding research and training in engineering and the physical sciences, investing more than £800 million a year.",Established 1994. Triennial Review began 2013. Not separately identifiable as board diversity data is provided on an anonymous basis. ,"Polaris House, North Star Avenue, Swindon SN2 1ET",01793 444000,-,http://www.epsrc.ac.uk/,Dr Paul Golby,"£16,430",Professor Dave Delpy,"£145,000-£150,000",Yes,Yes,Yes,PHSO,2012-13,2014,"£939,766,900","£939,766,900",209,NAO,Yes,Ministerial,Paid,1,0,0,Ministerial,0,10,4,0,1
