1,Veterinary Products Committee,"Department for Environment, Food and Rural Affairs",Advisory NDPB,FULL,Retain,No,"Advises the Secretary of State on veterinary medicines, animal feed additives and promotes the collection of information relating to suspected adverse reactions to veterinary medicines. It considers representations by market authorisation holders/applicants in relation to granting, refusal or revocation of a marketing authorisation or animal test certificate.","Established in 1970 by an order made under the Medicines Act 1968.  In 2005 the order was revoked by the Veterinary Medicines Regulations 2005. However, the regulations, which are revoked and replaced regularly, provided that there should continue to be a VPC. Chair's appointment is paid on preparation and attendance fee per meeting basis.","VMD, Woodham Lane, New Haw, Addlestone, Surrey KT15 3LS  ",01932 338490,vpc@vmd.defra.gsi.gov.uk,http://www.vmd.defra.gov.uk/vpc/,Prof W J (Bill) Reilly BVMS BSc DVSM HonFRCVS.,£185 attendance fee plus £94 preparation per meeting.  ,Colin Bennett,Civil Servant,Yes,Yes,Yes,PHSO,2013,2013,"£51,000","£102,000",0,-,yes,Ministerial,Paid,1,0,0,Ministerial,Paid,16,1,7,1
1,Commonwealth Scholarship Commission in the UK,Department for International Development,Executive NDPB,FULL,Retain,No,"The Commission is responsible for managing Britains contribution to the Commonwealth Scholarship and Fellowship Plan; an international programme under which member governments offer scholarships and fellowships to citizens of other Commonwealth countries.
",Established 1959. Members are paid an honorarium for each selection committee for which they assess applications.,"c/o The Association of Commonwealth Universities, Woburn House, 20-24 Tavistock Square, London, WC1H 9HF",020 7380 6700,-,http://cscuk.dfid.gov.uk/,Professor Tim Unwin,"£6,000",Dr John Kirkland,Not paid by CSC,Yes,Yes,Yes,PHSO,2012-13,2013,"£23,709,000","£24,080,000",0,"Crowe, Clark, Whitehall",Yes,Ministerial,Paid,1,0,0,12 Ministerial,Paid,7,5,0,1
1,Independent Commission for Aid Impact,Department for International Development,Advisory NDPB,FULL,-,Yes,"Independent Commission for Aid Impact (ICAI) is the independent body responsible for scrutinising UK aid. ICAI carries out independent reviews of aid programmes and of issues affecting the delivery of UK aid. ICAI publishes transparent, impartial and objective reports to provide evidence and clear recommendations to support UK Government decision-making and to strengthen the accountability of the aid programme.","Established 2011.  Tom McDonald was Head of Secretariat until June 2013. Chair's remuneration is £600 per a day, up to 65 days per year. ICAI is subject to DFID's internal audit arrangements. The Comptroller and Auditor General also has full access to undertake value for money and financial audits.","Independent Commission for Aid Impact, Dover House, 66 Whitehall, London SW1A 2AU",020 7270 6736,"enquiries@icai.independent.gov.uk
",http://icai.independent.gov.uk/,"Graham Ward CBE, MA, FCA  Chief Commissioner",£600 per day,"Alexandra Cran McGreehin
",Civil Servant,No,Yes,Yes,-,2012-13,2013,"£3,806,000","£3,453,000",2,-,Yes,Ministerial,Paid   ,1,0,0,3 Ministerial,Paid,2,1,0,1
1,British Transport Police Authority,Department for Transport,Executive NDPB,FULL,Retain,No,"The Authority is the independent body responsible for ensuring an efficient and effective British Transport Police (BTP) force for rail operators, their staff and passengers.",Established on 1 July 2004. The Authoritys costs are met from the BTPs charges to rail operators. The information provided here is for the Authority only as the BTP Force is outside the scope of this report. Triennial Review commenced in 2012/13.,"The Forum, 5th Floor North, 74-80 Camden Street, London, NW1 0EG",020 7383 0259,general.enquiries@btpa.police.uk,http://btpa.police.uk/,Urmila Banerjee CBE,"£32,237",Andrew Figgures CB CBE,"135,000-140,000",Yes,Yes,Yes,-,2012-13,2013-14,"£31,000","£1,875,900",12,NAO,Yes,Ministerial,Paid,0,1,0,12 Ministerial,12 Paid,9,3,0,1
1,Directly Operated Railways Ltd,Department for Transport,Executive NDPB,FULL,Retain,No,"DOR fulfils the Secretary of State for Transport's requirements under the Railways Act to secure the continued provision of passenger railway services should an existing franchise not be able to complete its full term. At present DOR has a number of subsidiaries one of which is active: the active subsidiary is the East Coast Main Line Company Ltd, which is itself outside of the scope of this report.","Income for DOR is in the main generated from ticket revenue from passenger services on the East Coast railway and associated services. DOR also provides services direct to DfT in connection with the Secretary of States obligations under the Railways Act. These services are provided and paid for under separate contracts direct with the DfT on a supplier basis. The turnover of DOR and East Coast Mainline Ltd was £720 million, as per the 13-14 Annual Report.

","4th Floor, One Kemble Street, London, WC2B 4AN",020 7904 5043,enquiries@directlyoperatedrailways.co.uk,http://www.directlyoperatedrailways.co.uk/,Doug Sutherland,"£100,000",Michael Holden,"£250,000",No,No,Yes,-,2013/2014,-,£0,£0,6,Pricewaterhouse Coopers,No,Non-ministerial,Paid,1,0,0,Non-Ministerial ,Paid,4,0,0,1
1,Disabled Persons Transport Advisory Committee (DPTAC),Department for Transport,Advisory NDPB,FULL,Retain,No,Statutory body set up under the Transport Act 1985 to advise the Government on transport policy as it affects the mobility of disabled people.,Established  1986.  Chair does not take payment.  The 2012/2013 Annual Report has not yet been published; funding and expenditure figures are preliminary.  DPTAC was proposed to cease being an NDPB but a decision to retain it was made in June 2013.,"c/o 2/16 Great Minster House, 33 Horseferry Road, London, SW1P 4DR",0300 330 3000,dptac.enquiries@dft.gsi.gov.uk,https://www.gov.uk/government/organisations/disabled-persons-transport-advisory-committee,Dai Powell,£0,-,-,No,No,Yes,PHSO,2010-11,2013,"£106,078","£106,078",1,-,Yes,Ministerial,Unpaid,1,0,0,Ministerial  ,"11 Paid, 1 unpaid (Civil Servant)",5,7,0,1
1,Driver and Vehicle Licensing Agency (DVLA),Department for Transport,Executive Agency,FULL,Retain,Yes,"The DVLA ensures that complete and accurate registers of drivers and vehicles are held and makes them as accessible and as flexible as possible, to those who have the right to use them.  These registers underpin action by DVLA, the police and others to maintain the high levels of road safety experienced in the UK and the effective collection of vehicle excise duty (VED). DVLA registers are used to deliver other departmental and government initiatives such as traffic management and reducing carbon emissions.","Oliver Morley was appointed as Chief Executive effective from 4th November 2013, salary shown is the full year equivalent. ","Longview Road, Morriston, Swansea SA6 7JL",Drivers - 03007906801 Vehicles - 03007906802,enquiries@dvla.gov.uk,https://www.gov.uk/government/organisations/driver-and-vehicle-licensing-agency,-,-,Oliver Morley,"£125,000-£130,000 ",No,No,Yes,PHSO,2013-2014,2013-14,"£90,000,000","£500,299,000","4,985",NAO,No,0,0,0,0,0,Non-Ministerial ,Paid,2,1,0,1
1,Driving Standards Agency,Department for Transport,Executive Agency,FULL,Merged,Yes,"Driver and Vehicle Standards Agency improves road safety in Great Britain by setting standards for driving and motorcycling, and making drivers, vehicle operators and MOT garages understand and follow roadworthiness standards. We also provide a range of licensing, testing, education and enforcement services.",DSA is in the process of merging with Vehicle and Operator Services Agency  (VOSA) to become a single Driver and Vehicle Standards Agency and one trading fund from April 2015. DSA and VOSA aleady have a single CEO.,"Berkeley House, Croydon Street, Bristol, BS5 0DA
Switchboard: 0117 954 3200",0115 9366186,nikki.sevens@dsa.gsi.gov.uk,www.gov.uk/dvsa,-,-,Alastair Peoples,"£110,000-£115,000",No,No,Yes,PHSO,2013-2014,2014,"£11,112,000","£175,260,000","2,099",NAO ,No,0,0,0,0,0,Non-Ministerial ,Paid,1,2,0,1
1,High Speed 2 Ltd,Department for Transport,Executive NDPB,FULL,Retain,No,"In June 2013, after the second reading of the High Speed Rail (Preparation) Bill, the Secretary of State clarified that HS2 Ltd should continue to act both in a delivery and advisory role for the development of the high speed rail network. In its delivery role, HS2 Ltd is: to help make High Speed Two an Engine for Growth; provide advice to enable the Department for Transport to deposit a Hybrid Bill in Parliament for Phase One (London to West Midlands); and develop the design of Phase Two (West Midlands to Leeds and Manchester).
In its advisory role, HS2 Ltd is to: undertake strategic work on longer term options for serving Scotland and the North East; advise the Department on costs, benefits and commercial issues for Phase One; take forward initial work on the train and systems operations for the railway and work with the Department to develop options for the future delivery and operational model.","HS2 Ltd was incorporated under the Companies Act, limited by guarantee, in January 2009. It has a sole member, the Secretary of State, for whom it is remitted to undertake work. HS2 Ltd is a separate legal entity from the Crown and is also an Executive NDPB sponsored by the Secretary of State. The Chief Executives remuneration figure given is the salary and excludes pension costs. HS2 Ltd is fully funded from the public purse by grants-in-aid from DfT - DfT's allocated budget for HS2 Ltd was £247.7 million in 2013/14. Actual expenditure for 2013/14 was £212.9 million. The High Speed Rail (Preparation) Act 2013 received royal assent in November 2013 and authorises HS2 Ltd to incur expenditure in preparation for a high speed railway transport network. Under its authority, HS2 Ltd will undertake further detailed design work, let contracts for designing the construction of the line, design the realignment of existing railway, plan the movement of utilities, carry out ground investigation and ecological surveys, and, through DfT, to purchase property and make compensation payments to homeowners.","High Speed Two Limited, 2nd Floor, Eland House, Bressenden Place, London SW1E 5DU",020 7944 4908,"HS2enquiries@hs2.org.uk
",http://www.hs2.org.uk/,Sir David Higgins ,"170,191",Alison Munro,"£125,000-£130,000",No,Yes,Yes,PHSO,2013-14,2011-12,"£209,548,264","£208,428,000",346,NAO,Yes,Ministerial,Paid  ,1,0,0,3 Ministerial and 3 non-Ministerial,6 Paid,4,2,0,1
1,Highways Agency,Department for Transport,Executive Agency,FULL,Retain,No,"The Highways Agency (HA) was created in March 1994 as an executive agency of the Department for Transport. The Highways Agency operates, maintains and improves 7,000km of strategic road network, which comprises the majority of Englands motorways and major A roads.

 ","HA was set up to help support the sustainability of the UK's economy by operating, maintaining and improving the strategic road network in England on behalf of the Secretary of State.","Highways Agency, Federated House, London Road, Dorking, RH4 1SZ",01306 878667,-,http://www.highways.gov.uk/,Alan Cook,"£40,000",Graham Dalton,"£145,000-£150,000",No,Yes,Yes,PHSO,2013-2014,-,"£2,268,000,000","£2,559,623,000","3,380",NAO,No,Ministerial,Paid,1,0,0,Non-Ministerial,Paid,4,1,0,1
1,Maritime and Coastguard Agency,Department for Transport,Executive Agency,FULL,Retain,Yes,"The Maritime and Coastguard Agency (MCA) is an Executive Agency of the DfT. It provides a 24-hour maritime search and rescue service; enforces ship safety, prevents pollution, promotes seafarer health, safety and welfare standards by survey and inspection; registers and certificates ships and seafarers; and manages pollution prevention and response. ",Established on 1 April 1998.,"(Head Office) Spring Place, 105 Commercial Rd, Southampton SO15 1EG
",023 8032 9100,infoline@mcga.gov.uk,http://www.dft.gov.uk/mca/,-,-,Sir Alan Massey,"£115,000-£120,000",Yes,No,Yes,PHSO,2013-2014,-,"£165,000,000","£167,624,000","1,003",NAO,No,0,0,0,0,0,3,Paid,2,1,-,1
1,Northern Lighthouse Board (Commissioners of Northern Lighthouses),Department for Transport,Executive NDPB,FULL,Retain,Yes,"The Commissioners of Northern Lighthouses (operating as the Northern Lighthouse Board) have various powers and responsibilities in connection with the provision, maintenance, alteration, inspection and control of lighthouses, buoys and beacons. The Board operates around Scotland and the Isle of Man.","The Commissioners of Northern Lighthouses (operating as the Northern Lighthouse Board) are funded from light dues paid by ship owners using British and Irish ports.  As well as one Ministerial appointment, the Secretary of State  also makes one nomination to NLB's Board.  Expenditure information as per 2013-2014 Annual Report.  The current Chair is remunerated. 

Commodore Mike Bullock commenced his appointment as Chief Executive on 29 April 2014. The Former Chief Executive was Roger Lockwood.

The Northern Lighthouse Board was subject to Triennial Review during this period.","84 George Street, Edinburgh, EH2 3DA",0131 473 3100 ,enquiries@nlb.org.uk ,http://www.nlb.org.uk/,Captain H M Close ,"£15,000-£20,000",Mike Bullock,"£110,000-£115,000",No,Yes,Yes,PHSO,2013-2014,2013/2014,£0,"£19,254,000",180,NAO,No,Non-ministerial,Paid,1,0,0,0,5 Paid/ 13 unpaid,15,3,0,1
1,Passenger Focus/Passengers' Council,Department for Transport,Executive NDPB,FULL,Retain and substantially reform,No,"Passenger Focus (officially the Passengers Council) is the independent passenger watchdog, whose mission is to get the best deal for passengers. Passenger Focus represents rail passengers in England, Scotland and Wales, bus and tram passengers in England (outside London) and passengers on scheduled domestic coach services in England.",Established by Railways Act 2005 (as amended).,"3rd Floor, Fleetbank House, 2-6 Salisbury Square, London EC4Y 8JX",0300 123 0855,jon.carter@passengerfocus.org.uk,http://www.passengerfocus.org.uk/,Colin Foxall CBE,"£52,841",Anthony Smith,"£124,243",Yes,Yes,Yes,PHSO,2013-2014,2005,"£4,930,000","£5,304,000",41,NAO,Yes,Ministerial,Paid,1,0,0,8 Ministerial; 1 non-Ministerial,Paid,6,3,0,1
1,Traffic Commissioners and Deputies,Department for Transport,Tribunal NDPB,FULL,Retain,Yes,The seven Traffic Commissioners are appointed by the Secretary of State for Transport and have responsibility for: the licensing of the operators of heavy goods vehicles (HGVs) and of buses and coaches; the registration of local bus services and taking action against drivers of HGVs and (PSVs) public service vehicles in certain circumstances.,Established 1931.  There are eight Traffic Commissioner areas - one person holds the posts for both Wales and the West Midlands. The Senior Traffic Commissioner is Beverley Bell. No appointments information provided as no board or committee.,"Senior Traffic Commissioner Suite 4 Stone Cross Place, Stone Cross Lane, Golborne, Warrington, WA3 2SH

",01942 295021,Beverley.bell@otc.gsi.gov.uk,https://www.gov.uk/government/publications/traffic-commissioners,Multiple ,"£119,941",-,-,No,No,Yes,-,2013-2014,2007,£0,£0,-,-,No,-,0,0,0,0,0,0,0,0,0,1
1,Trinity House,Department for Transport,Executive NDPB,FULL,Retain,Yes,"Trinity House has powers and responsibilities in connection with the provision, maintenance, alteration, inspection and control of lighthouses, buoys and beacons for England and Wales,  the Channel Islands, and at Gibraltar. Trinity House carries out a number of Maritime Charitable activities which are outside of its role as an NDPB.","Trinity House was granted a Royal Charter by Henry VIII in 1514.  There are no statutory Ministerial appointments, but the Secretary of State nominates three Non Executive members to sit on the Board. Trinity House (Lighthouse Service) is funded from light dues paid by ship owners using British and Irish Ports.  

Trinity House (in its capacity as a lighthouse authority) was subject to Triennial Review during this period.","Trinity Square  Tower Hill, City of London, Greater London EC3N 4DH",020 7481 6900,enquiries@thls.org,http://www.trinityhouse.co.uk/,-,-,Captain Ian McNaught,"£100,000-£120,000",No,No,Yes,PHSO,2013-2014,2013/2014,£0,"£33,238,000",296,NAO,No,Non-ministerial,Paid,1,0,0,Non-Ministerial,Paid,6,1,0,1
1,Vehicle and Operator Services Agency  ,Department for Transport,Executive Agency,FULL,Merged,Yes,"DVSA improves road safety in Great Britain by setting standards for driving and motorcycling, and making drivers, vehicle operators and MOT garages understand and follow roadworthiness standards. We also provide a range of licensing, testing, education and enforcement services.",Vehicle and Operator Services Agency  (VOSA) is in the process of merging with Driver  Standards Agency  (DSA) to become a single Driver and Vehicle Standards Agency (DVSA) and one trading fund from April 2015. VOSA and DSA aleady have a single CEO.,"Berkeley House, Croydon Street, Bristol, BS5 0DA
Switchboard: 0117 954 3200",0115 9366186,nikki.sevens@dsa.gsi.gov.uk,www.gov.uk/dvsa,-,-,Alastair Peoples,"£110,000 -£115,000",No,Yes,Yes,PHSO,2013-2014,2014,£0,"£170,441,000","2,223",NAO ,No,0,0,0,0,0,0,0,0,0,0,1
1,Vehicle Certification Agency,Department for Transport,Executive Agency,FULL,Retain,Yes,"The Vehicle Certification Agency (VCA) is an Executive Agency of the Department for Transport (DfT). The VCA delivers its responsibilities to the Secretary of State for Transport as the UK Type Approval Authority for new on and off-road vehicles, systems and components.",Established 1990. Board are Civil Service appointment,"1, Eastgate Office Centre, Eastgate Road, Bristol, BS5 6XX",0117 9515151,enquiries@vca.gov.uk,http://www.dft.gov.uk/vca/,-,-,Paul Markwick,"£95,000-£100,000",No,No,Yes,PHSO,2013-2014,-,£0,"£15,815,000",204,NAO,No,-,0,0,0,0,-,-,-,-,0,1
1,Health and Safety Executive,Department for Work and Pensions,Executive NDPB,FULL,Retain,Yes,"The mission for HSE is the prevention of death, injury and ill health to those at work and those affected by work activities.","Established April 2008 (as a new unitary body, following HSEs original establishment in 1975).   ","Redgrave Court, Merton Road, Bootle, L20 7HS",01519 514 000,http://www.hse.gov.uk/contact/index.htm,http://www.hse.gov.uk/,Judith Hackitt,-,Kevin Myers (TDA from 1st Septenber 2013),Civil Servant ,Yes,Yes,Yes,PHSO,2013-14,2014,"£154,268,000","£278,918,000",3081,NAO,Yes,Ministerial,Paid,0,0,1,"9 Ministerial, 1 non-Ministerial","9 Paid, 1 unpaid",7,3,0,1
1,Independent Living Fund,Department for Work and Pensions,Executive NDPB,FULL,Retain,No,A trust with the power to make payments to assist severely disabled people to live independently.,"Established 1988. One trust closed and another opened in 1993, trusts amalgamated in 2007.  The future of the Independent Living Fund (ILF) was the subject of an external consultation exercise prior to its closure being originally announced in 2012.  Following a Court of Appeal decision in November 2013 closure activity ceased.  A further Ministerial decision on 6 March 2014 confirmed the ILF will now close on 30 June 2015.  In addition to UK funding shown below, the ILF received £8,536,000 from the Department for Social Development in Northern Ireland in 13-14.","Equinox House, City Link, Nottingham, NG2 4LA ",0845 601 8815,funds@ilf.gsi.org.uk,http://www.dwp.gov.uk/ilf,Stephen Jack,"£19, 500",James Sanderson,"£104,884",No,Yes,Yes,PHSO,2013-14,2006,"£293,456,000","£293,100,000",111,NAO & Deloittes,Yes,Ministerial,Paid,1,0,0,5 Ministerial,Paid,3,2,0,1
1,Industrial Injuries Advisory Council,Department for Work and Pensions,Advisory NDPB,FULL,Retain,No,"To advise DWP Ministers on matters relating to the Industrial Injuries Scheme and its administration. In particular, which diseases and occupations should give entitlement to Industrial Injuries Disablement Benefit and advising on any draft regulations relating to the Scheme.",Established 1948.  DWP provide a secretariat equivalent of 2.2 Full-time staff.,"Zone B, 2nd Floor, Caxton House, Tothill Street, London, SW1H 9NA",020 7449 5618,iiac@dwp.gsi.gov.uk,http://iiac.independent.gov.uk/,Professor Keith Palmer,"£1,878",Rebecca Murphy / Lucy O'Sullivan (Job Share),Civil Servant,Yes,Yes,Yes,PHSO,2013-14,2012,"£48,000","£29,730",-,N/A,Yes,Ministerial,Paid,1,0,0,Ministerial,Paid,11,3,0,1
1,National Employment Savings Trust (NEST) Corporation,Department for Work and Pensions,Executive NDPB,FULL,Retain,No,"To run, and act as the Trustee of, the NEST Pension Scheme. Employers can use NEST to meet their legal duties to enrol workers into a workplace pension. It is designed for a target market of low to moderate earners that is largely new to pensions saving. ",NEST Corporation is a body corporate set up in July 2010 as the successor to the Personal Accounts Delivery Authority (PADA) and is funded by; 1) Grant-in-aid which covers costs associated with the function of government; 2) draw down on government loan.  It has dual status as an Executive NDPB and a Public Corporation. In the 2013/14 financial year NEST Corporation received £60.0m in the form of a government (DWP) loan with interest at the standard government rate.,"Riverside House, 2a Southwark Bridge Road, London, SE1 9HA",020 3056 3600 ,enquiries@nestcorporation.org.uk,http://www.nestpensions.org.uk/,Lawrence Churchill,"£95,000 - £100,000",Tim Jones,"£230,000-£235,000",No,Yes,Yes,Pensions Ombudsman,2013-14,-,"£70,245,000","£76,800,000",268,NAO,Yes,Ministerial,Paid,1,0,0,Ministerial,Paid,6,5,0,1
1,Pension Protection Fund Ombudsman,Department for Work and Pensions,Tribunal NDPB,FULL,Merge,No,To investigate and decide on complaints about the way cases have been handled by the Board of the Pension Protection Fund,"Established April 2005. To be merged with the Pensions Ombudsman.  Remuneration, staff and financial information is included under the Pensions Ombudsman entry.","6th Floor, 11 Belgrave Road, London, SW1V 1RB",020 7630 2200,enquiries@pensions-ombudsman.org.uk,http://www.ppfo.org.uk/,-,-,Tony King - Ombudsman,see Pensions Ombudsman,No,No,Yes,PHSO (administration matters only),2013-14,2014,-,-,0,NAO,Yes,0,0,0,0,0,0,0,0,0,0,1
1,"Pensions Advisory Service, The",Department for Work and Pensions,Executive NDPB,FULL,Retain,No,To provide an independent and free information and guidance service to members of the public who have a query or complaint on a private pensions matter,Established 1983. A company limited by guarantee. ,"11 Belgrave Road, London, SW1V 1RB",0300 123 1047,enquiries@pensionsadvisoryservice.org.uk,http://www.pensionsadvisoryservice.org.uk/,Partha Dasgupta,"£30,000",Michelle Cracknell,"£100,000",No,No,Yes,-,2013-14,2014,"£3,353,269","£3,301,750",40,NAO,Yes,Ministerial,Paid,1,0,0,6 Non-Ministerial ,6 Paid,2,4,0,1
1,Pensions Ombudsman,Department for Work and Pensions,Tribunal NDPB,FULL,Merge,No,To investigate and decide on complaints and disputes concerning occupational and personal pension schemes. The Ombudsman is completely independent and acts as an impartial adjudicator.,Established April 1991. To be merged with the Pensions Protection Fund Ombudsman.  Appointment information for the Pension Ombudsman is also shown under the Pension Protection Fund Ombudsman entry.,"6th Floor, 11 Belgrave Road, London SW1V 1RB",020 7630 2200,enquiries@pensions-ombudsman.org.uk,http://www.pensions-ombudsman.org.uk/,-,-,Tony King - Ombudsman,"£129,579",No,No,Yes,PHSO (administration matters only),2013-14,2014,"£3,179,000","£3,172,096",38,NAO,Yes,0,0,0,0,0,Ombudsman -Ministerial,Paid,1,0,0,1
1,Pensions Regulator,Department for Work and Pensions,Executive NDPB,FULL,Retain,Yes,"To protect the benefits of members of work based pensions schemes, to reduce the risk of situations arising that may lead to claims for compensation from the Pension Protection Fund, to maximise employer compliance with duties and safeguards and in relation to detained benefits schemes to minimise the adverse effects of regulatory activity on the sustainable growth of employers.",Established April 2005.  ,"Napier House, Trafalgar Place, Brighton, East Sussex, BN1 4DW",0845 etc,customersupport@thepensionsregulator.gov.uk,http://www.thepensionsregulator.gov.uk/,Michael O'Higgins,"£57,000",Vacant-Interim CEO Stephen Soper,"£210,000 - £215,000",No,Yes,Yes,PHSO,2013-14,2014,"£56,883,000","£54,419,000",536,NAO,Yes,Ministerial,Paid,1,0,0,Ministerial,Paid,7,2,0,1
1,Remploy Ltd,Department for Work and Pensions,Executive NDPB,FULL,Retain,No,Remploy's mission is to transform the lives of disabled people and those experiencing complex barriers to work by providing sustainable employment opportunities,"The figures for 2013/14 are not yet available. Government funding includes Grant-in-Aid, contract payments, modernisation funding and transition costs not all of which will have been spent in 12/13. Figures shown are the audited figures in Remploy's accounts. Remploy has dual status as an Executive NDPB and a Public Corporation. The Chair has elected not to draw remuneration.","Remploy Ltd, 18c Meridian East, Meridian Business Park, Leicester LE19 1WZ",0845 155 2700,info@remploy.co.uk,http://www.remploy.co.uk/,Ian Russell,-,Beth Carruthers,"£125,000",No,No,Yes,PHSO,2013,2011,-,-,1047,Deloitte,Yes,Ministerial,Paid ,1,0,0,Ministerial,Paid ,4,1,0,1
